[
  {
    "score_id": "score-dfd6b7294e1b",
    "storyline_id": "coffee-creative-sample",
    "title_pair": {
      "left": "COFFEE",
      "right": "COFFEE WITH YOU"
    },
    "format": "x-with-you",
    "left_scene": "Dinko sits properly on one rounded café chair at a small table, cradling a cream mug and looking neutral and slightly bored. A simple counter and compact coffee machine sit behind him.",
    "right_scene": "Dinka and Dinko sit on separate matching café chair seats at the same table, their equal-size round bodies gently touching while each cradles a matching cream mug. The same counter and coffee machine remain behind them.",
    "emotional_insight": "The same first cup feels warmer because the quiet routine is shared.",
    "why_someone_would_share": "It resembles an achievable daily ritual people recognize in their own relationship.",
    "relevant_social_learnings": [],
    "brand_placement_opportunities": [
      "coffee mug",
      "coffee bag"
    ],
    "execution_risks": [
      "characters sitting on the table",
      "oversized mugs",
      "different character sizes"
    ],
    "recommended_background_color": "dusty peach",
    "recommended_accent_color": "muted sage",
    "recommended_camera_angle": "medium straight-on",
    "props": [
      "table",
      "chairs",
      "mugs",
      "counter",
      "coffee machine"
    ],
    "character_count": 2,
    "novel_angle": "The environment stays exactly matched so body contact becomes the only meaningful visual change.",
    "scores": {
      "emotional_clarity": 9,
      "relatability": 9,
      "visual_simplicity": 7,
      "scroll_stopping_potential": 8,
      "shareability": 8,
      "save_potential": 8,
      "comment_potential": 5,
      "dinkly_brand_fit": 8,
      "originality": 9,
      "brand_integration_potential": 8,
      "nano_banana_execution_ease": 6,
      "risk_of_character_distortion": 6
    },
    "directional_total": 7.5,
    "weakest_criterion": "comment_potential",
    "improvement_recommendation": "Add a specific recognizable habit without using engagement bait.",
    "evaluation_label": "directional creative evaluation, not a performance prediction",
    "created_at": "2026-08-06T16:25:23+00:00"
  },
  {
    "score_id": "score-29bf802e5a5c",
    "storyline_id": "concept-1c825b820d63",
    "title_pair": {
      "left": "BRUSHING TEETH",
      "right": "BRUSHING TEETH WITH YOU"
    },
    "format": "x-with-you",
    "left_scene": "Dinko experiences toothbrush alone in side-by-side sinks, correct relative toothbrush scale, with a neutral, bored, or slightly sad expression—never happy.",
    "right_scene": "Dinka and Dinko share the same toothbrush activity in the same setting, warmly connected while the environment remains recognizably consistent. Side-by-side sinks, correct relative toothbrush scale.",
    "emotional_insight": "Domestic familiarity",
    "why_someone_would_share": "It turns the familiar feeling of domestic familiarity into a recognizable “that reminds me of us” moment.",
    "relevant_social_learnings": [
      "learning-20260806-varied-moments-repeated-format",
      "learning-20260806-low-energy-to-shared-abundance"
    ],
    "brand_placement_opportunities": [],
    "execution_risks": [
      "Keep Dinka and Dinko the same size and preserve all locked character features.",
      "Keep both characters grounded and unobscured by props.",
      "Keep each toothbrush narrower than one eye and shorter than one-third of a body width."
    ],
    "recommended_background_color": "pistachio",
    "recommended_accent_color": "dark green",
    "recommended_camera_angle": "medium straight-on",
    "props": [
      "simple sink counter",
      "two correctly scaled toothbrushes"
    ],
    "character_count": 2,
    "novel_angle": "Side-by-side sinks, correct relative toothbrush scale",
    "scores": {
      "emotional_clarity": 9,
      "relatability": 8,
      "visual_simplicity": 9,
      "scroll_stopping_potential": 9,
      "shareability": 8,
      "save_potential": 6,
      "comment_potential": 5,
      "dinkly_brand_fit": 8,
      "originality": 9,
      "brand_integration_potential": 3,
      "nano_banana_execution_ease": 8,
      "risk_of_character_distortion": 4
    },
    "directional_total": 7.42,
    "weakest_criterion": "brand_integration_potential",
    "improvement_recommendation": "Identify one natural prop a partner product could replace without changing the story.",
    "evaluation_label": "directional creative evaluation, not a performance prediction",
    "created_at": "2026-08-06T18:29:46+00:00"
  },
  {
    "score_id": "score-3e785c9a63b4",
    "storyline_id": "concept-fce1bdba7f09",
    "title_pair": {
      "left": "NO PLANS",
      "right": "NO PLANS WITH YOU"
    },
    "format": "x-with-you",
    "left_scene": "Dinko experiences no plans alone in large negative space, floor cushions, with a neutral, bored, or slightly sad expression—never happy.",
    "right_scene": "Dinka and Dinko share the same no plans activity in the same setting, warmly connected while the environment remains recognizably consistent. Large negative space, floor cushions.",
    "emotional_insight": "Doing nothing becomes enough",
    "why_someone_would_share": "It turns the familiar feeling of doing nothing becomes enough into a recognizable “that reminds me of us” moment.",
    "relevant_social_learnings": [
      "learning-20260806-varied-moments-repeated-format",
      "learning-20260806-low-energy-to-shared-abundance"
    ],
    "brand_placement_opportunities": [],
    "execution_risks": [
      "Keep Dinka and Dinko the same size and preserve all locked character features.",
      "Keep both characters grounded and unobscured by props."
    ],
    "recommended_background_color": "soft lavender",
    "recommended_accent_color": "dark purple",
    "recommended_camera_angle": "medium straight-on",
    "props": [
      "floor cushions"
    ],
    "character_count": 2,
    "novel_angle": "Large negative space, floor cushions",
    "scores": {
      "emotional_clarity": 9,
      "relatability": 6,
      "visual_simplicity": 9,
      "scroll_stopping_potential": 9,
      "shareability": 8,
      "save_potential": 6,
      "comment_potential": 5,
      "dinkly_brand_fit": 8,
      "originality": 9,
      "brand_integration_potential": 3,
      "nano_banana_execution_ease": 10,
      "risk_of_character_distortion": 1
    },
    "directional_total": 7.67,
    "weakest_criterion": "brand_integration_potential",
    "improvement_recommendation": "Identify one natural prop a partner product could replace without changing the story.",
    "evaluation_label": "directional creative evaluation, not a performance prediction",
    "created_at": "2026-08-06T18:53:03+00:00"
  },
  {
    "score_id": "score-759adf297204",
    "storyline_id": "concept-d0c2b1b99bc0",
    "title_pair": {
      "left": "WALKS",
      "right": "WALKS WITH YOU"
    },
    "format": "x-with-you",
    "left_scene": "Girl DINKLY walks alone with his nub arms tucked behind his round body. Setting: a quiet minimalist park path. Purposeful props: curved park path, one fallen leaf. Emotion: Quiet and reflective, never happy.",
    "right_scene": "Boy DINKLY and Girl DINKLY walk close together and hold nub arms while looking at each other. Setting: the same quiet minimalist park path. Purposeful props: same curved path, two coffee cups, small flowers, one butterfly. Emotion: Warm, affectionate, and present.",
    "emotional_insight": "Quiet and reflective, never happy. The same moment feels warmer together.",
    "why_someone_would_share": "It turns quiet and reflective, never happy. the same moment feels warmer together. into a recognizable “that reminds me of us” moment.",
    "relevant_social_learnings": [
      "learning-20260806-varied-moments-repeated-format",
      "learning-20260806-low-energy-to-shared-abundance"
    ],
    "brand_placement_opportunities": [
      "Replace one existing coffee prop without changing the story."
    ],
    "execution_risks": [
      "Imply walking without visible legs",
      "Use nub-to-nub contact without fingers",
      "Keep the butterfly small and secondary"
    ],
    "recommended_background_color": "warm sage",
    "recommended_accent_color": "soft coral",
    "recommended_camera_angle": "medium profile view",
    "props": [
      "curved park path",
      "one fallen leaf",
      "same curved path",
      "two coffee cups",
      "small flowers",
      "one butterfly"
    ],
    "left_character": "girl",
    "left_character_action": "walks alone with his nub arms tucked behind his round body",
    "left_setting": "a quiet minimalist park path",
    "left_props": [
      "curved park path",
      "one fallen leaf"
    ],
    "left_emotion": "Quiet and reflective, never happy.",
    "right_characters": "boy_and_girl",
    "right_character_actions": "walk close together and hold nub arms while looking at each other",
    "right_setting": "the same quiet minimalist park path",
    "right_props": [
      "same curved path",
      "two coffee cups",
      "small flowers",
      "one butterfly"
    ],
    "right_emotion": "Warm, affectionate, and present.",
    "shared_environment": "Same park path, horizon, ground line, and side-view camera.",
    "environmental_contrast": "Left uses one fallen leaf and open space. Right adds shared coffee, flowers, and one butterfly without changing the path.",
    "character_count": 2,
    "novel_angle": "Left uses one fallen leaf and open space. Right adds shared coffee, flowers, and one butterfly without changing the path.",
    "scores": {
      "emotional_clarity": 10,
      "relatability": 9,
      "visual_simplicity": 6,
      "scroll_stopping_potential": 8,
      "shareability": 9,
      "save_potential": 8,
      "comment_potential": 5,
      "dinkly_brand_fit": 10,
      "originality": 9,
      "brand_integration_potential": 6,
      "nano_banana_execution_ease": 6,